{
  "name": "Dynamic FPS",
  "filename": "dynamic-fps-3.11.9+minecraft-26.2.0-fabric.jar",
  "side": "client",
  "download": {
    "url": "https://cdn.modrinth.com/data/LQ3K71Q1/versions/pC2JjFw1/dynamic-fps-3.11.9%2Bminecraft-26.2.0-fabric.jar",
    "hash-format": "sha512",
    "hash": "79b13548d7e9de9abfa23e062724a885e5341f371c500d6570056ecea7db00c2f7ace5a7288179ad8baec575b4aa992b91dccbc940c584cb5cddf0bc7aeb892f"
  },
  "update": {
    "modrinth": {
      "mod-id": "LQ3K71Q1",
      "version": "pC2JjFw1"
    }
  }
}
