{
  "name": "Allurement",
  "filename": "allurement-1.20.1-4.0.0.jar",
  "side": "both",
  "download": {
    "hash-format": "sha1",
    "hash": "1687ae1c9475c70f4044e7b381aa8df1c4249e1e",
    "mode": "metadata:curseforge"
  },
  "update": {
    "curseforge": {
      "file-id": 5228059,
      "project-id": 438003,
      "release-channel": ""
    }
  }
}
