{
  "name": "YetAnotherConfigLib",
  "filename": "yet_another_config_lib_v3-3.9.4+26.1-fabric.jar",
  "side": "both",
  "download": {
    "hash-format": "sha1",
    "hash": "c167cc420d29af5d30a23ce9feb1330a25ce06db",
    "mode": "metadata:curseforge"
  },
  "update": {
    "curseforge": {
      "file-id": 8196582,
      "project-id": 667299,
      "release-channel": ""
    }
  }
}
