{
  "name": "Collective",
  "filename": "collective-26.1.2-8.32.jar",
  "side": "both",
  "download": {
    "hash-format": "sha1",
    "hash": "13887a5d78938c6ce55c15bcbd1352db625e84e1",
    "mode": "metadata:curseforge"
  },
  "update": {
    "curseforge": {
      "file-id": 8317567,
      "project-id": 342584
    }
  }
}
