{
  "name": "Ascended Quark",
  "filename": "ascended_quark-1.20.1-1.1.6.jar",
  "side": "both",
  "download": {
    "hash-format": "sha1",
    "hash": "a315ec052939f5d23a1b95ebf2184040ca1ad1b0",
    "mode": "metadata:curseforge"
  },
  "update": {
    "curseforge": {
      "file-id": 6321663,
      "project-id": 971104,
      "release-channel": ""
    }
  }
}
