{
  "name": "mob-ai-tweaks-1.10.1-1.20.1",
  "filename": "mob-ai-tweaks-1.11.2.jar",
  "side": "both",
  "download": {
    "url": "https://cdn.modrinth.com/data/egIM2bKK/versions/sEVcufgn/mob-ai-tweaks-1.11.2.jar",
    "hash-format": "sha512",
    "hash": "7182244a05e35b055d9fc07782df93e8893fced531fda74ff2abd4cc413b9a746f434f1fdd1db17f05deb6fdabca18416b6743f81523b5f1a2ef1dc66a0122a9"
  },
  "update": {
    "modrinth": {
      "mod-id": "egIM2bKK",
      "version": "sEVcufgn"
    }
  }
}
