{
  "name": "Text Placeholder API",
  "filename": "placeholder-api-2.4.0-pre.3+1.20.4.jar",
  "side": "both",
  "download": {
    "url": "https://cdn.modrinth.com/data/eXts2L7r/versions/VYMQNs7A/placeholder-api-2.4.0-pre.3%2B1.20.4.jar",
    "hash-format": "sha512",
    "hash": "d2044d957b8f07f08ef4bf154c720803a5cac3e9eac504fc127321ea6ca08ed9f06a6bb3e433814b292c8bb6152b513fd6275a81aa168e9185b7c9f167d6d3a5"
  },
  "update": {
    "modrinth": {
      "mod-id": "eXts2L7r",
      "version": "VYMQNs7A"
    }
  }
}
