{
  "name": "Polytone",
  "filename": "polytone-1.21.4-3.3.24-fabric.jar",
  "side": "client",
  "download": {
    "url": "https://cdn.modrinth.com/data/3qAYkBMB/versions/7rPD3Q0C/polytone-1.21.4-3.3.24-fabric.jar",
    "hash-format": "sha512",
    "hash": "8afba4359286b281ddbe0e603d1525e0ff4573f4a7ee30c1bbe8ef75e4b0a8aef2e6604ddb182404ec3b152e23ce3052e9277ac5248911f88f213cd3aa3db2ff"
  },
  "update": {
    "modrinth": {
      "mod-id": "3qAYkBMB",
      "version": "7rPD3Q0C"
    }
  }
}
