{
  "name": "Bare Bones",
  "filename": "Bare Bones 1.21.11.zip",
  "side": "client",
  "download": {
    "url": "https://cdn.modrinth.com/data/rox3U8B6/versions/jQBWn2Q3/Bare%20Bones%201.21.11.zip",
    "hash-format": "sha512",
    "hash": "268b578d6d34adaa2491572af4cabf65fab94edee00e688f5b4cb4f072c0620c492d58a4442769e6a889cd940cfe3c4a4fe65e5bb422b8e283ad174e32ceefb0",
    "extra-hashes": {
      "sha1": "2023465d2bac693b009c65c4e2566c2d58e2c2c6"
    },
    "size": 5488875
  },
  "update": {
    "modrinth": {
      "mod-id": "rox3U8B6",
      "version": "jQBWn2Q3"
    }
  }
}
