{
  "name": "sss-1.20-1.1.0",
  "filename": "sss-1.20-1.1.0.jar",
  "side": "both",
  "download": {
    "url": "https://cdn.modrinth.com/data/7h71R8kR/versions/Qm4hQiUn/sss-1.20-1.1.0.jar",
    "hash-format": "sha512",
    "hash": "c6c9efb57df3e3ecb0cb5b60a23d39285329195a950773f758b59250dda566ca02b90ea6e2e027ba2c03daeabcfc3715dca4f7adddb9ff35773ff8829bffc0df"
  },
  "update": {
    "modrinth": {
      "mod-id": "7h71R8kR",
      "version": "Qm4hQiUn"
    }
  }
}
