{
  "name": "Mass Effect Mash-up",
  "filename": "Mass Effect.zip",
  "side": "client",
  "download": {
    "url": "https://cdn.modrinth.com/data/27e5KETs/versions/u0aJfMeM/Mass%20Effect.zip",
    "hash-format": "sha512",
    "hash": "3e559c667f9e1ae8b412ef707f22196de3554783d79fd718e1292256ab1233a8a398249b62534b7917f4be0705e76a567c8aa5908bbc59d552fa1b3133e7e832"
  },
  "update": {
    "modrinth": {
      "mod-id": "27e5KETs",
      "version": "u0aJfMeM"
    }
  }
}
