{
  "name": "cherishedworlds fabric 10.1.1+1.21.1",
  "filename": "cherishedworlds-fabric-10.1.1+1.21.1.jar",
  "side": "both",
  "download": {
    "url": "https://cdn.modrinth.com/data/3azQ6p0W/versions/nPgbZ9q1/cherishedworlds-fabric-10.1.1%2B1.21.1.jar",
    "hash-format": "sha512",
    "hash": "8b44e4d5a282c6d06e5f9b7780bc19f0b0ae1161087fabc19fcd966e7b71cc82db7a4c62d67192a43ac844092fd9145bb5a99cd1daa5b762b923fca05dbc62a8",
    "extra-hashes": {
      "sha1": "c4a0e044b2f34ed2f0ae5e64c22cc46ff4f10c4a"
    },
    "size": 63643
  },
  "update": {
    "modrinth": {
      "mod-id": "3azQ6p0W",
      "version": "nPgbZ9q1"
    }
  }
}
