{
  "name": "YUNG's Better Jungle Temples",
  "filename": "YungsBetterJungleTemples-1.21.1-NeoForge-3.1.2.jar",
  "side": "server",
  "download": {
    "url": "https://cdn.modrinth.com/data/z9Ve58Ih/versions/P00i2hJn/YungsBetterJungleTemples-1.21.1-NeoForge-3.1.2.jar",
    "hash-format": "sha512",
    "hash": "eca4233e874a55886c63d2111b8685d479771d3627bad2922582e65b78c51ba74733dc4624aabf91f2a2178a940a72d9209ae33eef74e34f84f07d62256709d9",
    "extra-hashes": {
      "sha1": "d6b7ce6cf351b09cbd23147ff166c35cfdc572e8"
    },
    "size": 795839
  },
  "update": {
    "modrinth": {
      "mod-id": "z9Ve58Ih",
      "version": "P00i2hJn"
    }
  }
}
