{
  "name": "Legacy4J",
  "filename": "Legacy4J-1.21.5-1.9-pre-3-lts-fabric.jar",
  "side": "server",
  "download": {
    "url": "https://cdn.modrinth.com/data/gHvKJofA/versions/B4UKgIvm/Legacy4J-1.21.5-1.9-pre-3-lts-fabric.jar",
    "hash-format": "sha512",
    "hash": "fb6b0a526da9ad942115227361e4dc164662df645607cffcc682cf273acade4202d9644e3a5589ee673455254d616e715c3b0c2c797ecad3f24f45a578f04583",
    "extra-hashes": {
      "sha1": "200f083dce6a25e25ccaae7fec5de86ccd176cc4"
    },
    "size": 25747604
  },
  "update": {
    "modrinth": {
      "mod-id": "gHvKJofA",
      "version": "B4UKgIvm"
    }
  }
}
