{
  "name": "LambDynamicLights",
  "filename": "lambdynamiclights-4.12.2+26.2.jar",
  "side": "client",
  "download": {
    "url": "https://cdn.modrinth.com/data/yBW8D80W/versions/jBLH7Qy8/lambdynamiclights-4.12.2%2B26.2.jar",
    "hash-format": "sha512",
    "hash": "3c2ab4028e47da4155e860c9449231d7b17e10dc6d9d110ab58dc621ab806fcc0b21741c73a671c0d72fb9ae5021792cea18f09b515180ae33e86c4008c3d139"
  },
  "update": {
    "modrinth": {
      "mod-id": "yBW8D80W",
      "version": "jBLH7Qy8"
    }
  }
}
