{
  "name": "puffish_attributes-0.8.1-1.20-forge",
  "filename": "puffish_attributes-0.8.2-1.20-forge.jar",
  "side": "both",
  "download": {
    "url": "https://cdn.modrinth.com/data/FCFcFw09/versions/IG5KY4Qf/puffish_attributes-0.8.2-1.20-forge.jar",
    "hash-format": "sha512",
    "hash": "b8d2829d665d29dc6e6b48b6e8973d3002c07d5a0ddc3dc46d052abcc13d3a06eaa3b7669464db902b5642f2f9d923f3612c8a84317f0e567515f59c133d572b"
  },
  "update": {
    "modrinth": {
      "mod-id": "FCFcFw09",
      "version": "IG5KY4Qf"
    }
  }
}
