{
  "name": "Structure Layout Optimizer",
  "filename": "structure_layout_optimizer-1.1.4+26.1-fabric.jar",
  "side": "server",
  "download": {
    "url": "https://cdn.modrinth.com/data/ayPU0OHc/versions/JwbecFqq/structure_layout_optimizer-1.1.4%2B26.1-fabric.jar",
    "hash-format": "sha512",
    "hash": "d0a443e5a71dc6a40f6345b49b73aee5290d5726f68a5b05d3b31b9ff71262dd2986518df8a560f2097e7584b944ff462d621499f5dede10afa624a34359e8cc"
  },
  "update": {
    "modrinth": {
      "mod-id": "ayPU0OHc",
      "version": "JwbecFqq"
    }
  }
}
