{
  "name": "Hookshot - From Zelda",
  "filename": "hookshot-1.20.1-1.1.3.jar",
  "side": "both",
  "download": {
    "hash-format": "sha1",
    "hash": "ff724ed618ce6e554ed97101184efc06aea5754a",
    "mode": "metadata:curseforge"
  },
  "update": {
    "curseforge": {
      "file-id": 8447042,
      "project-id": 1065199,
      "release-channel": ""
    }
  }
}
