{
  "name": "Fabric Language Kotlin",
  "filename": "fabric-language-kotlin-1.13.13+kotlin.2.4.10.jar",
  "side": "both",
  "download": {
    "url": "https://cdn.modrinth.com/data/Ha28R6CL/versions/bdhiINYC/fabric-language-kotlin-1.13.13%2Bkotlin.2.4.10.jar",
    "hash-format": "sha512",
    "hash": "9a63c35a550b0362b7b25ff045d93709c7b0dae08c89076cba422813fdfb9e5f5dd021ed3afac9f82e74e95b88c249e8f68b240717151540ca3e88cc27fb9c77"
  },
  "update": {
    "modrinth": {
      "mod-id": "Ha28R6CL",
      "version": "bdhiINYC"
    }
  }
}
