{
  "name": "CraftTweaker",
  "filename": "CraftTweaker-forge-1.20.1-14.0.60.jar",
  "side": "both",
  "download": {
    "url": "https://cdn.modrinth.com/data/Xg35A4rS/versions/8GR4gItx/CraftTweaker-forge-1.20.1-14.0.60.jar",
    "hash-format": "sha512",
    "hash": "7352168dffbdc23b472f767940c9c139b321d940b496bf8505c502c35aed33f686d35b2b3b67acbf5a4efb82ad90907412df67a85f6464ea685445d9655e9679"
  },
  "update": {
    "modrinth": {
      "mod-id": "Xg35A4rS",
      "version": "8GR4gItx"
    }
  }
}
