{
  "name": "Pro Placer",
  "filename": "ProPlacer-v26.1.0-mc26.1.x-Fabric.jar",
  "side": "both",
  "download": {
    "hash-format": "sha1",
    "hash": "93c81de3deab581c422aa9d86e8f0decc915e32a",
    "mode": "metadata:curseforge"
  },
  "update": {
    "curseforge": {
      "file-id": 7987095,
      "project-id": 368320
    }
  }
}
