{
  "name": "Particle Core",
  "filename": "particle_core-0.3.3+1.21+neoforge.jar",
  "side": "client",
  "download": {
    "url": "https://cdn.modrinth.com/data/RSeLon5O/versions/2QF4NhZD/particle_core-0.3.3%2B1.21%2Bneoforge.jar",
    "hash-format": "sha512",
    "hash": "bf14200f4f279c2c5f5a50e09ef561f34463848fde507cb5930e4f4dbfed107697387ce030593be37a14da73cc459b0901928466fb44b2c2a387c584f38ec489"
  },
  "update": {
    "modrinth": {
      "mod-id": "RSeLon5O",
      "version": "2QF4NhZD"
    }
  }
}
